[
  {
    "id": "ocd-membership/62972150-b22c-55a6-a997-a3bdf89d33c4",
    "person_id": "ocd-person/991cfc3b-6f4c-590a-a105-5ae9ff3a4a25",
    "organization_id": "ocd-organization/305463d2-a712-563d-8e68-bea1f06d0212",
    "post_id": "templeton-ma/planning-board",
    "role": "Planning Board Member",
    "seat": "1",
    "how_seated": "elected",
    "sources": [
      {
        "url": "https://www.templetonma.gov/Directory.aspx?did=34",
        "retrieved": "2026-08-25"
      }
    ]
  },
  {
    "id": "ocd-membership/86d040dd-7f8b-54e8-9ba1-220215ef94d2",
    "person_id": "ocd-person/6a97a0f8-a92b-54a5-b0b9-66b7145fc4ee",
    "organization_id": "ocd-organization/305463d2-a712-563d-8e68-bea1f06d0212",
    "post_id": "templeton-ma/planning-board",
    "role": "Planning Board Member",
    "seat": "2",
    "how_seated": "elected",
    "sources": [
      {
        "url": "https://www.templetonma.gov/Directory.aspx?did=34",
        "retrieved": "2026-08-25"
      }
    ]
  },
  {
    "id": "ocd-membership/28915405-6536-57cb-8412-97f10a4d3b10",
    "person_id": "ocd-person/15b45cb7-7a7a-527c-9bf6-2747ac50d249",
    "organization_id": "ocd-organization/305463d2-a712-563d-8e68-bea1f06d0212",
    "post_id": "templeton-ma/planning-board",
    "role": "Planning Board Member",
    "seat": "3",
    "how_seated": "elected",
    "sources": [
      {
        "url": "https://www.templetonma.gov/Directory.aspx?did=34",
        "retrieved": "2026-08-25"
      }
    ]
  },
  {
    "id": "ocd-membership/5a56d4ed-28ee-5729-8b28-692f6380a518",
    "person_id": "ocd-person/674048b4-7066-593a-bc28-3257a9a3bc99",
    "organization_id": "ocd-organization/305463d2-a712-563d-8e68-bea1f06d0212",
    "post_id": "templeton-ma/planning-board",
    "role": "Planning Board Member",
    "seat": "4",
    "how_seated": "elected",
    "sources": [
      {
        "url": "https://www.templetonma.gov/Directory.aspx?did=34",
        "retrieved": "2026-08-25"
      }
    ]
  },
  {
    "id": "ocd-membership/730dc866-f72b-58d1-a9a4-a424bbeff345",
    "person_id": "ocd-person/4c716dd9-73e2-5d96-b24e-f79f02196c28",
    "organization_id": "ocd-organization/305463d2-a712-563d-8e68-bea1f06d0212",
    "post_id": "templeton-ma/planning-board",
    "role": "Planning Board Member",
    "seat": "5",
    "how_seated": "elected",
    "sources": [
      {
        "url": "https://www.templetonma.gov/Directory.aspx?did=34",
        "retrieved": "2026-08-25"
      }
    ]
  },
  {
    "id": "ocd-membership/e625efe1-7de6-54e1-9244-f7f46b433a28",
    "person_id": "ocd-person/c6c557f1-ac92-5d63-ad59-87a797a940cd",
    "organization_id": "ocd-organization/d5a63560-7d60-5eaf-8c8e-553b6905e5ca",
    "post_id": "templeton-ma/community-preservation-at-large",
    "role": "Community Preservation Committee At-Large Member",
    "seat": "1",
    "how_seated": "elected",
    "sources": [
      {
        "url": "https://www.templetonma.gov/1327/Community-Preservation-Committee",
        "retrieved": "2026-08-25"
      }
    ]
  },
  {
    "id": "ocd-membership/50d6a3a8-e608-5aa0-9c19-03f5b24ddf4e",
    "person_id": "ocd-person/e0bbe988-8445-5b63-a1f6-d826cf4215d8",
    "organization_id": "ocd-organization/d5a63560-7d60-5eaf-8c8e-553b6905e5ca",
    "post_id": "templeton-ma/community-preservation-at-large",
    "role": "Community Preservation Committee At-Large Member",
    "seat": "2",
    "how_seated": "elected",
    "sources": [
      {
        "url": "https://www.templetonma.gov/1327/Community-Preservation-Committee",
        "retrieved": "2026-08-25"
      }
    ]
  },
  {
    "id": "ocd-membership/8e3839fb-4530-5175-8beb-7d50ab01740c",
    "person_id": "ocd-person/e310aab3-e938-5915-a16d-434b6a957cf3",
    "organization_id": "ocd-organization/d5a63560-7d60-5eaf-8c8e-553b6905e5ca",
    "post_id": "templeton-ma/community-preservation-at-large",
    "role": "Community Preservation Committee At-Large Member",
    "seat": "3",
    "how_seated": "elected",
    "sources": [
      {
        "url": "https://www.templetonma.gov/1327/Community-Preservation-Committee",
        "retrieved": "2026-08-25"
      }
    ]
  }
]
