[
  {
    "id": "ocd-membership/247bc150-cd63-5678-89b5-67f7a019de6f",
    "person_id": "ocd-person/431b64a3-bba2-5a5a-a44a-405a4c0c2053",
    "organization_id": "ocd-organization/3f678826-b473-5402-a6c1-f6518f8962ca",
    "post_id": "waltham-ma/mayor",
    "role": "Mayor",
    "seat": "1",
    "how_seated": "elected",
    "sources": [
      {
        "url": "https://www.city.waltham.ma.us/1715/About-Mayor-Jeannette-A-McCarthy",
        "retrieved": "2026-08-25"
      }
    ]
  },
  {
    "id": "ocd-membership/642afa3d-dab7-52a3-9446-a5d1de44d210",
    "person_id": "ocd-person/b8cea900-b313-577b-ba52-07c03529429b",
    "organization_id": "ocd-organization/8e179f6b-c3fb-5ffc-9f10-c57dbc998017",
    "post_id": "waltham-ma/city-council-at-large",
    "role": "City Councillor At-Large",
    "seat": "1",
    "how_seated": "elected",
    "sources": [
      {
        "url": "https://www.city.waltham.ma.us/1341/City-Council",
        "retrieved": "2026-08-25"
      }
    ]
  },
  {
    "id": "ocd-membership/f10678b3-dfe5-5a11-8dee-e57181b9ee0c",
    "person_id": "ocd-person/85bb8275-7043-5817-aaf0-dffb9ff3dc34",
    "organization_id": "ocd-organization/8e179f6b-c3fb-5ffc-9f10-c57dbc998017",
    "post_id": "waltham-ma/city-council-at-large",
    "role": "City Councillor At-Large",
    "seat": "2",
    "how_seated": "elected",
    "sources": [
      {
        "url": "https://www.city.waltham.ma.us/1341/City-Council",
        "retrieved": "2026-08-25"
      }
    ]
  },
  {
    "id": "ocd-membership/9b885141-1399-5d4c-9146-82c1c9a50137",
    "person_id": "ocd-person/52a4fda0-478d-5502-9534-fc67d6e60c3f",
    "organization_id": "ocd-organization/8e179f6b-c3fb-5ffc-9f10-c57dbc998017",
    "post_id": "waltham-ma/city-council-at-large",
    "role": "City Councillor At-Large",
    "seat": "3",
    "how_seated": "elected",
    "sources": [
      {
        "url": "https://www.city.waltham.ma.us/1341/City-Council",
        "retrieved": "2026-08-25"
      }
    ]
  },
  {
    "id": "ocd-membership/9d81f8bb-1115-582e-b357-79ee8fe667e4",
    "person_id": "ocd-person/35a95a7b-a861-513f-ae47-4e986d0c19ff",
    "organization_id": "ocd-organization/8e179f6b-c3fb-5ffc-9f10-c57dbc998017",
    "post_id": "waltham-ma/city-council-at-large",
    "role": "City Councillor At-Large",
    "seat": "4",
    "how_seated": "elected",
    "sources": [
      {
        "url": "https://www.city.waltham.ma.us/1341/City-Council",
        "retrieved": "2026-08-25"
      }
    ]
  },
  {
    "id": "ocd-membership/b4fd9dfb-61c3-5b8c-9783-67847fcc58fa",
    "person_id": "ocd-person/04aa0f69-c353-5f40-a748-5dac6f11c927",
    "organization_id": "ocd-organization/8e179f6b-c3fb-5ffc-9f10-c57dbc998017",
    "post_id": "waltham-ma/city-council-at-large",
    "role": "City Councillor At-Large",
    "seat": "5",
    "how_seated": "elected",
    "sources": [
      {
        "url": "https://www.city.waltham.ma.us/1341/City-Council",
        "retrieved": "2026-08-25"
      }
    ]
  },
  {
    "id": "ocd-membership/01fe52cf-7254-5b8e-8957-da305fb19354",
    "person_id": "ocd-person/8af78d6d-994d-54d4-8f0f-2dc9263ac38f",
    "organization_id": "ocd-organization/8e179f6b-c3fb-5ffc-9f10-c57dbc998017",
    "post_id": "waltham-ma/city-council-at-large",
    "role": "City Councillor At-Large",
    "seat": "6",
    "how_seated": "elected",
    "sources": [
      {
        "url": "https://www.city.waltham.ma.us/1341/City-Council",
        "retrieved": "2026-08-25"
      }
    ]
  },
  {
    "id": "ocd-membership/28ce37d4-237b-5dbc-bef3-415c2dd16314",
    "person_id": "ocd-person/246f55ea-6606-5539-aa40-cef40542ab0e",
    "organization_id": "ocd-organization/e808a325-43a1-5fbe-8e8c-5d13b4bf9a09",
    "post_id": "waltham-ma/city-council-ward",
    "role": "Ward City Councillor",
    "seat": "1",
    "how_seated": "elected",
    "sources": [
      {
        "url": "https://www.city.waltham.ma.us/1341/City-Council",
        "retrieved": "2026-08-25"
      }
    ]
  },
  {
    "id": "ocd-membership/aa94f6a5-8559-5ae7-aa87-7e5c6267b38e",
    "person_id": "ocd-person/761378f5-f15e-574b-9cba-11724a07f5e8",
    "organization_id": "ocd-organization/e808a325-43a1-5fbe-8e8c-5d13b4bf9a09",
    "post_id": "waltham-ma/city-council-ward",
    "role": "Ward City Councillor",
    "seat": "2",
    "how_seated": "elected",
    "sources": [
      {
        "url": "https://www.city.waltham.ma.us/1341/City-Council",
        "retrieved": "2026-08-25"
      }
    ]
  },
  {
    "id": "ocd-membership/4c8bf963-327f-58cb-91e8-c34d37a48125",
    "person_id": "ocd-person/f0058413-3711-59e3-825b-b146e26d6e04",
    "organization_id": "ocd-organization/e808a325-43a1-5fbe-8e8c-5d13b4bf9a09",
    "post_id": "waltham-ma/city-council-ward",
    "role": "Ward City Councillor",
    "seat": "3",
    "how_seated": "elected",
    "sources": [
      {
        "url": "https://www.city.waltham.ma.us/1341/City-Council",
        "retrieved": "2026-08-25"
      }
    ]
  },
  {
    "id": "ocd-membership/3e6924e3-db2f-5e93-975f-0512edbe29d8",
    "person_id": "ocd-person/695d0bbf-93d4-58a0-b9d6-e070e8a22687",
    "organization_id": "ocd-organization/e808a325-43a1-5fbe-8e8c-5d13b4bf9a09",
    "post_id": "waltham-ma/city-council-ward",
    "role": "Ward City Councillor",
    "seat": "4",
    "how_seated": "elected",
    "sources": [
      {
        "url": "https://www.city.waltham.ma.us/1341/City-Council",
        "retrieved": "2026-08-25"
      }
    ]
  },
  {
    "id": "ocd-membership/6b7506f0-810e-57e3-87b2-bfba6f895823",
    "person_id": "ocd-person/b3d267c2-d0e1-5376-8a1b-82f2b8b7caf3",
    "organization_id": "ocd-organization/e808a325-43a1-5fbe-8e8c-5d13b4bf9a09",
    "post_id": "waltham-ma/city-council-ward",
    "role": "Ward City Councillor",
    "seat": "5",
    "how_seated": "elected",
    "sources": [
      {
        "url": "https://www.city.waltham.ma.us/1341/City-Council",
        "retrieved": "2026-08-25"
      }
    ]
  },
  {
    "id": "ocd-membership/1a4851fc-b518-5071-9c7a-edb8180e3e0b",
    "person_id": "ocd-person/630b963d-b88d-54db-944f-88971730b6e6",
    "organization_id": "ocd-organization/e808a325-43a1-5fbe-8e8c-5d13b4bf9a09",
    "post_id": "waltham-ma/city-council-ward",
    "role": "Ward City Councillor",
    "seat": "6",
    "how_seated": "elected",
    "sources": [
      {
        "url": "https://www.city.waltham.ma.us/1341/City-Council",
        "retrieved": "2026-08-25"
      }
    ]
  },
  {
    "id": "ocd-membership/2446060a-25dc-5644-8e1d-45dee2dfa994",
    "person_id": "ocd-person/7d29d7aa-109a-5446-9a6e-c7a7d8edff89",
    "organization_id": "ocd-organization/e808a325-43a1-5fbe-8e8c-5d13b4bf9a09",
    "post_id": "waltham-ma/city-council-ward",
    "role": "Ward City Councillor",
    "seat": "7",
    "how_seated": "elected",
    "sources": [
      {
        "url": "https://www.city.waltham.ma.us/1341/City-Council",
        "retrieved": "2026-08-25"
      }
    ]
  },
  {
    "id": "ocd-membership/2d3585a4-1d9a-57c0-b4d6-554e98329ab8",
    "person_id": "ocd-person/ef5842ef-0c96-5bc1-af3b-748db18d2685",
    "organization_id": "ocd-organization/e808a325-43a1-5fbe-8e8c-5d13b4bf9a09",
    "post_id": "waltham-ma/city-council-ward",
    "role": "Ward City Councillor",
    "seat": "8",
    "how_seated": "elected",
    "sources": [
      {
        "url": "https://www.city.waltham.ma.us/1341/City-Council",
        "retrieved": "2026-08-25"
      }
    ]
  },
  {
    "id": "ocd-membership/693398ac-3c8c-5d9a-9466-31a0f6360061",
    "person_id": "ocd-person/467c793f-12d3-5f9a-834d-53a561935f7a",
    "organization_id": "ocd-organization/e808a325-43a1-5fbe-8e8c-5d13b4bf9a09",
    "post_id": "waltham-ma/city-council-ward",
    "role": "Ward City Councillor",
    "seat": "9",
    "how_seated": "elected",
    "sources": [
      {
        "url": "https://www.city.waltham.ma.us/1341/City-Council",
        "retrieved": "2026-08-25"
      }
    ]
  }
]
