[
  {
    "id": "ocd-membership/cc0fc24b-a4eb-53f8-a36c-53bd8c947f4c",
    "person_id": "ocd-person/d20a94e3-6554-51e8-95ab-9ef6d590716f",
    "organization_id": "ocd-organization/923bbe7f-4471-5e44-a044-5e8a2dc79d76",
    "post_id": "leominster-ma/mayor",
    "role": "Mayor",
    "seat": "1",
    "how_seated": "elected",
    "sources": [
      {
        "url": "https://www.leominster-ma.gov/157/Mayors-Office",
        "retrieved": "2026-08-25"
      }
    ]
  },
  {
    "id": "ocd-membership/2642b40e-521b-50ea-8f71-8a6a1570c31a",
    "person_id": "ocd-person/ea706a93-201c-598b-9571-0e03f3060a41",
    "organization_id": "ocd-organization/52e2f665-7d1e-5f7e-a3f7-aadc30046c94",
    "post_id": "leominster-ma/city-council",
    "role": "City Council Member",
    "seat": "At Large",
    "how_seated": "elected",
    "sources": [
      {
        "url": "https://www.leominster-ma.gov/221/City-Council",
        "retrieved": "2026-08-25"
      }
    ]
  },
  {
    "id": "ocd-membership/5118a58a-ccd2-56f6-b8b3-17cf36a6985d",
    "person_id": "ocd-person/49c1c80d-baee-5625-904e-8b206c9d5606",
    "organization_id": "ocd-organization/52e2f665-7d1e-5f7e-a3f7-aadc30046c94",
    "post_id": "leominster-ma/city-council",
    "role": "City Council Member",
    "seat": "At Large",
    "how_seated": "elected",
    "sources": [
      {
        "url": "https://www.leominster-ma.gov/221/City-Council",
        "retrieved": "2026-08-25"
      }
    ]
  },
  {
    "id": "ocd-membership/e4915672-9572-5a18-be53-67ab7ec2f624",
    "person_id": "ocd-person/1270f896-057e-544b-bfce-74a1d6fcae5e",
    "organization_id": "ocd-organization/52e2f665-7d1e-5f7e-a3f7-aadc30046c94",
    "post_id": "leominster-ma/city-council",
    "role": "City Council Member",
    "seat": "At Large",
    "how_seated": "elected",
    "sources": [
      {
        "url": "https://www.leominster-ma.gov/221/City-Council",
        "retrieved": "2026-08-25"
      }
    ]
  },
  {
    "id": "ocd-membership/a7cdf21d-537c-591a-93e8-1448956c12d2",
    "person_id": "ocd-person/80d64ec1-7f91-5621-b617-c6aa2949e861",
    "organization_id": "ocd-organization/52e2f665-7d1e-5f7e-a3f7-aadc30046c94",
    "post_id": "leominster-ma/city-council",
    "role": "City Council Member",
    "seat": "At Large",
    "how_seated": "elected",
    "sources": [
      {
        "url": "https://www.leominster-ma.gov/221/City-Council",
        "retrieved": "2026-08-25"
      }
    ]
  },
  {
    "id": "ocd-membership/6602fdce-e6be-5730-b4bf-b655a64309dd",
    "person_id": "ocd-person/6b0772e5-960d-58be-a2dc-10e08e084f79",
    "organization_id": "ocd-organization/52e2f665-7d1e-5f7e-a3f7-aadc30046c94",
    "post_id": "leominster-ma/city-council",
    "role": "City Council Member",
    "seat": "Ward 1",
    "how_seated": "elected",
    "sources": [
      {
        "url": "https://www.leominster-ma.gov/221/City-Council",
        "retrieved": "2026-08-25"
      }
    ]
  },
  {
    "id": "ocd-membership/24e57027-23a3-5036-8a77-2dc6a1062cb0",
    "person_id": "ocd-person/7461e399-faab-52fc-9eea-a7a6a8deab52",
    "organization_id": "ocd-organization/52e2f665-7d1e-5f7e-a3f7-aadc30046c94",
    "post_id": "leominster-ma/city-council",
    "role": "City Council Member",
    "seat": "Ward 2",
    "how_seated": "elected",
    "sources": [
      {
        "url": "https://www.leominster-ma.gov/221/City-Council",
        "retrieved": "2026-08-25"
      }
    ]
  },
  {
    "id": "ocd-membership/9567c0fa-c38e-534f-82b5-b74c189d762e",
    "person_id": "ocd-person/19f4de63-d1b2-555d-b09f-2f0e515ba54a",
    "organization_id": "ocd-organization/52e2f665-7d1e-5f7e-a3f7-aadc30046c94",
    "post_id": "leominster-ma/city-council",
    "role": "City Council Member",
    "seat": "Ward 3",
    "how_seated": "elected",
    "sources": [
      {
        "url": "https://www.leominster-ma.gov/221/City-Council",
        "retrieved": "2026-08-25"
      }
    ]
  },
  {
    "id": "ocd-membership/ffefe6ee-b025-5522-a64c-581a7c550447",
    "person_id": "ocd-person/3e456075-9634-5ac2-914d-c8fd739624ca",
    "organization_id": "ocd-organization/52e2f665-7d1e-5f7e-a3f7-aadc30046c94",
    "post_id": "leominster-ma/city-council",
    "role": "City Council Member",
    "seat": "Ward 4",
    "how_seated": "elected",
    "sources": [
      {
        "url": "https://www.leominster-ma.gov/221/City-Council",
        "retrieved": "2026-08-25"
      }
    ]
  },
  {
    "id": "ocd-membership/a7858e58-241b-583a-be8a-53c52f21d868",
    "person_id": "ocd-person/38046c89-a001-542a-96a5-d6724d5af291",
    "organization_id": "ocd-organization/52e2f665-7d1e-5f7e-a3f7-aadc30046c94",
    "post_id": "leominster-ma/city-council",
    "role": "City Council Member",
    "seat": "Ward 5",
    "how_seated": "elected",
    "sources": [
      {
        "url": "https://www.leominster-ma.gov/221/City-Council",
        "retrieved": "2026-08-25"
      }
    ]
  },
  {
    "id": "ocd-membership/82decab3-b7df-5248-923e-f3fb9dbe966f",
    "person_id": "ocd-person/1805b74c-6c7b-52dd-ac92-d84e6be17bde",
    "organization_id": "ocd-organization/b1623260-e0ad-5785-8a70-2bc17ba84682",
    "post_id": "leominster-ma/school-committee",
    "role": "School Committee Member",
    "seat": "At Large",
    "how_seated": "elected",
    "sources": [
      {
        "url": "https://www.leominster-ma.gov/376/Elections",
        "retrieved": "2026-08-25"
      }
    ]
  },
  {
    "id": "ocd-membership/c8e96e85-c3b9-5062-8cc5-8c2447fabe85",
    "person_id": "ocd-person/b57d96b8-fbd0-574c-aee6-c017810c0125",
    "organization_id": "ocd-organization/b1623260-e0ad-5785-8a70-2bc17ba84682",
    "post_id": "leominster-ma/school-committee",
    "role": "School Committee Member",
    "seat": "At Large",
    "how_seated": "elected",
    "sources": [
      {
        "url": "https://www.leominster-ma.gov/376/Elections",
        "retrieved": "2026-08-25"
      }
    ]
  },
  {
    "id": "ocd-membership/6dce94f6-23e3-5966-970f-6dfde2f25e20",
    "person_id": "ocd-person/2c27014d-de5f-58ec-9192-f981331bb313",
    "organization_id": "ocd-organization/b1623260-e0ad-5785-8a70-2bc17ba84682",
    "post_id": "leominster-ma/school-committee",
    "role": "School Committee Member",
    "seat": "At Large",
    "how_seated": "elected",
    "sources": [
      {
        "url": "https://www.leominster-ma.gov/376/Elections",
        "retrieved": "2026-08-25"
      }
    ]
  },
  {
    "id": "ocd-membership/aa4e1fc0-187a-5658-a63f-34fc54543bb1",
    "person_id": "ocd-person/af58a6c9-2e8e-56a2-b340-d0594b4a2ad2",
    "organization_id": "ocd-organization/b1623260-e0ad-5785-8a70-2bc17ba84682",
    "post_id": "leominster-ma/school-committee",
    "role": "School Committee Member",
    "seat": "Ward 4",
    "how_seated": "elected",
    "sources": [
      {
        "url": "https://www.leominster-ma.gov/376/Elections",
        "retrieved": "2026-08-25"
      }
    ]
  },
  {
    "id": "ocd-membership/a8805def-a5f8-5c0e-9829-eedd72c00993",
    "person_id": "ocd-person/e91070ee-7b32-515f-914a-cb928b87db99",
    "organization_id": "ocd-organization/b1623260-e0ad-5785-8a70-2bc17ba84682",
    "post_id": "leominster-ma/school-committee",
    "role": "School Committee Member",
    "seat": "Ward 5",
    "how_seated": "elected",
    "sources": [
      {
        "url": "https://www.leominster-ma.gov/376/Elections",
        "retrieved": "2026-08-25"
      }
    ]
  },
  {
    "id": "ocd-membership/7799151b-3d1d-5924-a48a-dabdaef85001",
    "person_id": "ocd-person/cfc512c0-6d57-58b7-9a83-fb7fd2d6e331",
    "organization_id": "ocd-organization/82f0f343-20c1-55a6-b15c-c5b14709764a",
    "post_id": "lexington-ma/planning-board",
    "role": "Planning Board Member",
    "seat": "1",
    "how_seated": "elected",
    "sources": [
      {
        "url": "https://www.lexingtonma.gov/DocumentCenter/View/14764/2026-Annual-Town-Election-Results-PDF",
        "retrieved": "2026-08-25"
      }
    ]
  },
  {
    "id": "ocd-membership/293a369a-c690-5883-ad9c-36372aa47783",
    "person_id": "ocd-person/3a187e75-072d-57d0-b9fb-e9a135db86ba",
    "organization_id": "ocd-organization/82f0f343-20c1-55a6-b15c-c5b14709764a",
    "post_id": "lexington-ma/planning-board",
    "role": "Planning Board Member",
    "seat": "2",
    "how_seated": "elected",
    "sources": [
      {
        "url": "https://www.lexingtonma.gov/DocumentCenter/View/14764/2026-Annual-Town-Election-Results-PDF",
        "retrieved": "2026-08-25"
      }
    ]
  },
  {
    "id": "ocd-membership/9e524f49-17a0-5636-bf6e-a657e51387c6",
    "person_id": "ocd-person/06bd0f31-8875-5063-bd89-1fdec491169d",
    "organization_id": "ocd-organization/7c27fc8f-4db5-5f23-8e46-576c421e35e5",
    "post_id": "lexington-ma/housing-authority",
    "role": "Housing Authority Member",
    "seat": "1",
    "how_seated": "elected",
    "sources": [
      {
        "url": "https://www.lexingtonma.gov/DocumentCenter/View/14764/2026-Annual-Town-Election-Results-PDF",
        "retrieved": "2026-08-25"
      }
    ]
  }
]
